{
  "api_version": "proof.dev/conformance/authentication-time-boundaries/v1",
  "issued_at": "2026-08-17T20:02:00Z",
  "expires_at": "2026-08-17T20:07:00Z",
  "max_future_skew_seconds": 30,
  "accepted_evaluated_at": [
    "2026-08-17T20:01:30Z",
    "2026-08-17T20:02:00Z",
    "2026-08-17T20:06:59.999999999Z"
  ],
  "rejected": [
    {
      "evaluated_at": "2026-08-17T20:01:29Z",
      "expected_code": "proof.auth.not_yet_valid"
    },
    {
      "evaluated_at": "2026-08-17T20:07:00Z",
      "expected_code": "proof.auth.expired"
    }
  ]
}
